{
  "evidence_id": "ev_P03_0",
  "task_id": "P03",
  "phase": "compiler",
  "revision": 0,
  "git_commit": "e089e09b4a11ada65d196451dfcac62e44f2b745",
  "graph_hash": "sha256:9acfb17678c64cf33d5a4e86ad9ef5aff5560a9cc90a482c0808b962ed1a9a05",
  "compiler_hash": "sha256:7f69e14fa7dbc04bdde16e822dd816d57e668da252206056b074f2d8e492509d",
  "runtime_hash": null,
  "host_compiler_hash": "sha256:e6abf55ab1859e7c990be77fd593f51661ea99fb2fde626ae9f4108aaa34e7fa",
  "unavailable_components": [
    "runtime"
  ],
  "target": "x86_64-unknown-linux-gnu",
  "toolchain_lock_hash": "sha256:e93471187b5d77aa4745b5d5a373c533dfcd11f1811faa698348682762f09a67",
  "commands": [
    {
      "id": "toolchain-rust",
      "argv_hash": "sha256:8486d9561e12a51de5ec438f1458ef70581e599bfa1409d96d0a6e46734a12f5",
      "exit_code": 0
    },
    {
      "id": "toolchain-llvm",
      "argv_hash": "sha256:5c218374ff9812343ea5a0c7f52fde7e40fd198706ab2ba639d194f20f90decb",
      "exit_code": 0
    },
    {
      "id": "environment-packages",
      "argv_hash": "sha256:367e60807afe55c0de8163e719f8ce2de648917e9122196e7cf7b53c3fddea98",
      "exit_code": 0
    },
    {
      "id": "git-revision-binding",
      "argv_hash": "sha256:0572ba01cc3a0f14ccdeca92c0225c15d09e5f0e19139f6bf36b9f3c7bf6c39b",
      "exit_code": 0
    },
    {
      "id": "rust-tests",
      "argv_hash": "sha256:795eb7c61d91ef39f1031a69bbf5c569b355ab8bec69bb77b577068b52e94c47",
      "exit_code": 0
    },
    {
      "id": "rust-release",
      "argv_hash": "sha256:1edcee5273bd09129a7227d8d31c5757bb447627d32b0698bb3a1cd1725c3f91",
      "exit_code": 0
    },
    {
      "id": "native-probe",
      "argv_hash": "sha256:8d2207034ad03cc8fa03c75a571f9b31e9f3ace19383ac879cf63b376876590f",
      "exit_code": 0
    },
    {
      "id": "graph-cli",
      "argv_hash": "sha256:016e9cbd04eec4d2ec9c0bae13568826fef7d4b6cb39d7c2fb289ffc9bcd6c16",
      "exit_code": 0
    },
    {
      "id": "semantic-cli",
      "argv_hash": "sha256:e65b17c3e5364dcd1ecfdf8d7c6d9c57269a7df687939c642e52d5ab4e9d80be",
      "exit_code": 0
    },
    {
      "id": "text-cli",
      "argv_hash": "sha256:7c6678f69c8c4ca741e587a0227bcbdfe00eef88af45b056a8c6310076bc9818",
      "exit_code": 0
    },
    {
      "id": "bootstrap-pre-commit",
      "argv_hash": "sha256:b8fa89c8ce791cba94a1e342d101c0c2bb3a72f73d8e9aeea929ae106d28c28c",
      "exit_code": 0
    },
    {
      "id": "bootstrap-unit-tests",
      "argv_hash": "sha256:5964df816921afcf874dbc56a1b0206891d331a603e281c3177b1778d8a97f8a",
      "exit_code": 0
    },
    {
      "id": "bootstrap-strict",
      "argv_hash": "sha256:ca7d1f05b24d34fac70f2f54ab737f8ad82f2ec0c5cb6c354c32b4ca73b60fb0",
      "exit_code": 0
    }
  ],
  "artifacts": [
    {
      "path": "examples/bootstrap/graph.json",
      "sha256": "sha256:9acfb17678c64cf33d5a4e86ad9ef5aff5560a9cc90a482c0808b962ed1a9a05"
    },
    {
      "path": "target/release/il",
      "sha256": "sha256:7f69e14fa7dbc04bdde16e822dd816d57e668da252206056b074f2d8e492509d"
    },
    {
      "path": "build/ci/result.json",
      "sha256": "sha256:dd481e4dcebadce235b60bdf933b908aa6138cdcfcdf04ff884f0263c7176b68"
    },
    {
      "path": "build/semantic_cli_report.json",
      "sha256": "sha256:d480c281faf86139f50eadbb3b505937ca350e966376cf278360fafa24f07479"
    },
    {
      "path": "build/text_cli_report.json",
      "sha256": "sha256:1cf2ea2fed929b14eb12d130f4e7b8babd98c49b1173dc7fb5b267bc9346c483"
    },
    {
      "path": "build/graph_cli_report.json",
      "sha256": "sha256:f6f4fee287e0ffcf6e2843ccae74c9f2d5be0cc29137ea73be4cd2a8da0dd649"
    },
    {
      "path": "build/ci/rust-tests.log",
      "sha256": "sha256:ef6b558b466a89c78a118dc6ffe69e21cecb634cada71ec103b098845f8eee89"
    },
    {
      "path": "build/failures/P03-740f7f7/result.json",
      "sha256": "sha256:b630c48b0b5df9cdc062bcb2f2bd41cadc2874fc291a6e16514dbb3ad21bda17"
    },
    {
      "path": "build/failures/P03-740f7f7/graph-cli.log",
      "sha256": "sha256:2322bb12efff2d9e458eeaea49763058ace6b0aeea99c7258cd321ca314eb9e1"
    }
  ],
  "tests": [
    {
      "suite": "rust-tests",
      "passed": true,
      "count": 54
    },
    {
      "suite": "native-probe",
      "passed": true,
      "count": 4
    },
    {
      "suite": "graph-cli",
      "passed": true,
      "count": 28
    },
    {
      "suite": "semantic-cli",
      "passed": true,
      "count": 231
    },
    {
      "suite": "text-cli",
      "passed": true,
      "count": 13
    },
    {
      "suite": "bootstrap-pre-commit",
      "passed": true,
      "count": 7
    },
    {
      "suite": "bootstrap-unit-tests",
      "passed": true,
      "count": 17
    },
    {
      "suite": "bootstrap-strict",
      "passed": true,
      "count": 9
    }
  ],
  "effects_delta": [],
  "capabilities_delta": [],
  "known_limits": [
    "Only the recorded task and gates are verified; later tasks are not verified."
  ]
}
