{
  "evidence_id": "ev_P00_0",
  "task_id": "P00",
  "phase": "bootstrap",
  "revision": 0,
  "git_commit": "39433754af16880f99012b645beb68ee4d28de9e",
  "graph_hash": "sha256:9acfb17678c64cf33d5a4e86ad9ef5aff5560a9cc90a482c0808b962ed1a9a05",
  "compiler_hash": null,
  "runtime_hash": null,
  "host_compiler_hash": "sha256:e6abf55ab1859e7c990be77fd593f51661ea99fb2fde626ae9f4108aaa34e7fa",
  "unavailable_components": [
    "compiler",
    "runtime"
  ],
  "target": "x86_64-unknown-linux-gnu",
  "toolchain_lock_hash": "sha256:e93471187b5d77aa4745b5d5a373c533dfcd11f1811faa698348682762f09a67",
  "commands": [
    {
      "id": "toolchain-rust",
      "argv_hash": "sha256:8486d9561e12a51de5ec438f1458ef70581e599bfa1409d96d0a6e46734a12f5",
      "exit_code": 0
    },
    {
      "id": "toolchain-llvm",
      "argv_hash": "sha256:5c218374ff9812343ea5a0c7f52fde7e40fd198706ab2ba639d194f20f90decb",
      "exit_code": 0
    },
    {
      "id": "environment-packages",
      "argv_hash": "sha256:367e60807afe55c0de8163e719f8ce2de648917e9122196e7cf7b53c3fddea98",
      "exit_code": 0
    },
    {
      "id": "bootstrap-pre-commit",
      "argv_hash": "sha256:b8fa89c8ce791cba94a1e342d101c0c2bb3a72f73d8e9aeea929ae106d28c28c",
      "exit_code": 0
    },
    {
      "id": "git-revision-binding",
      "argv_hash": "sha256:0572ba01cc3a0f14ccdeca92c0225c15d09e5f0e19139f6bf36b9f3c7bf6c39b",
      "exit_code": 0
    },
    {
      "id": "bootstrap-strict",
      "argv_hash": "sha256:ca7d1f05b24d34fac70f2f54ab737f8ad82f2ec0c5cb6c354c32b4ca73b60fb0",
      "exit_code": 0
    }
  ],
  "artifacts": [
    {
      "path": "examples/bootstrap/graph.json",
      "sha256": "sha256:9acfb17678c64cf33d5a4e86ad9ef5aff5560a9cc90a482c0808b962ed1a9a05"
    },
    {
      "path": "toolchain.lock",
      "sha256": "sha256:e93471187b5d77aa4745b5d5a373c533dfcd11f1811faa698348682762f09a67"
    }
  ],
  "tests": [
    {
      "suite": "bootstrap-pre-commit",
      "passed": true,
      "count": 7
    },
    {
      "suite": "bootstrap-strict",
      "passed": true,
      "count": 9
    }
  ],
  "effects_delta": [],
  "capabilities_delta": [],
  "known_limits": [
    "Only the recorded task and gates are verified; later tasks are not verified."
  ]
}
